{"schema_version":"private-recruiter-followthrough-checkpoint-v1","artifact_kind":"private_recruiter_followthrough_checkpoint","locale":"en","source_receipt":{"id":"D-104","source_version":"draft-v1","event_type":"screen_requested"},"action_state":"accepted","observed_date":"2026-08-08","next_measurement_event":"unknown","next_safe_action":"manual_reenter_private_prep","delivery":{"draft_only":true,"external_actions_authorized":false,"no_calendar_action":true,"raw_event_retained":false,"local_save_mode":"disabled","no_message_action":true}}
